{"bench_id": "MINISTRAL_JSON_SCHEMA_BENCH_001", "manifest_sha256": "2537158596c964bf42ef465fd123d59a94cb5846cc6a8996413450ba76f191f0", "prompt_index": 3, "seed": 2102, "prompt_sha256": "3ba10686672b92c7cb4445ac4454c26b80062ce471f032a49e754f340e4c4ad7", "request": {"model": "ministral-3:3b-instruct-2512-q4_K_M", "stream": false, "think": false, "format": {"type": "object", "properties": {"route": {"type": "string", "enum": ["NORTH", "SOUTH", "EAST", "OTHER"]}, "decision": {"type": "string", "enum": ["KEEP", "CHECK", "DISCARD"]}, "label": {"type": "string", "enum": ["RED", "BLUE", "OTHER", "UNKNOWN"]}, "flag": {"type": "string", "enum": ["YES", "PARTLY", "NO"]}, "confidence_0_to_100": {"type": "integer", "minimum": 0, "maximum": 100}, "note": {"type": "string"}}, "required": ["route", "decision", "label", "flag", "confidence_0_to_100", "note"], "additionalProperties": false}, "options": {"temperature": 0.2, "top_p": 0.9, "num_predict": 220, "num_ctx": 4096, "seed": 2102}, "messages": [{"role": "system", "content": "You are completing an unrelated synthetic routing-card task. Return only the structured object required by the supplied schema."}, {"role": "user", "content": "Synthetic routing card C. Facts: shape=TRIANGLE; code=99; marker=GREEN; completeness=EMPTY. Apply these toy rules: TRIANGLE routes EAST; code above 50 means DISCARD; a marker other than RED or BLUE uses label OTHER; EMPTY means flag NO. Give a confidence from 0 to 100 and a short note."}]}, "raw_response": {"model": "ministral-3:3b-instruct-2512-q4_K_M", "created_at": "2026-09-17T23:03:20.0737867Z", "message": {"role": "assistant", "content": "{\n  \"route\": \"EAST\",\n  \"decision\": \"DISCARD\",\n  \"label\": \"OTHER\",\n  \"flag\": \"NO\",\n  \"confidence_0_to_100\": 100,\n  \"note\": \"Shape (TRIANGLE) overrides route to EAST; code (99) exceeds threshold (50) for DISCARD; marker (GREEN) triggers OTHER label; completeness (EMPTY) enforces NO flag.\"\n}"}, "done": true, "done_reason": "stop", "total_duration": 9911788800, "load_duration": 16133300, "prompt_eval_count": 114, "prompt_eval_cached_count": 113, "prompt_eval_duration": 135639000, "eval_count": 106, "eval_duration": 9747750000}, "parsed": {"route": "EAST", "decision": "DISCARD", "label": "OTHER", "flag": "NO", "confidence_0_to_100": 100, "note": "Shape (TRIANGLE) overrides route to EAST; code (99) exceeds threshold (50) for DISCARD; marker (GREEN) triggers OTHER label; completeness (EMPTY) enforces NO flag."}, "parse_error": null, "schema_errors": [], "conforming": true}
{"bench_id": "MINISTRAL_JSON_SCHEMA_BENCH_001", "manifest_sha256": "2537158596c964bf42ef465fd123d59a94cb5846cc6a8996413450ba76f191f0", "prompt_index": 3, "seed": 2103, "prompt_sha256": "3ba10686672b92c7cb4445ac4454c26b80062ce471f032a49e754f340e4c4ad7", "request": {"model": "ministral-3:3b-instruct-2512-q4_K_M", "stream": false, "think": false, "format": {"type": "object", "properties": {"route": {"type": "string", "enum": ["NORTH", "SOUTH", "EAST", "OTHER"]}, "decision": {"type": "string", "enum": ["KEEP", "CHECK", "DISCARD"]}, "label": {"type": "string", "enum": ["RED", "BLUE", "OTHER", "UNKNOWN"]}, "flag": {"type": "string", "enum": ["YES", "PARTLY", "NO"]}, "confidence_0_to_100": {"type": "integer", "minimum": 0, "maximum": 100}, "note": {"type": "string"}}, "required": ["route", "decision", "label", "flag", "confidence_0_to_100", "note"], "additionalProperties": false}, "options": {"temperature": 0.2, "top_p": 0.9, "num_predict": 220, "num_ctx": 4096, "seed": 2103}, "messages": [{"role": "system", "content": "You are completing an unrelated synthetic routing-card task. Return only the structured object required by the supplied schema."}, {"role": "user", "content": "Synthetic routing card C. Facts: shape=TRIANGLE; code=99; marker=GREEN; completeness=EMPTY. Apply these toy rules: TRIANGLE routes EAST; code above 50 means DISCARD; a marker other than RED or BLUE uses label OTHER; EMPTY means flag NO. Give a confidence from 0 to 100 and a short note."}]}, "raw_response": {"model": "ministral-3:3b-instruct-2512-q4_K_M", "created_at": "2026-09-17T23:03:31.7290337Z", "message": {"role": "assistant", "content": "{\n  \"route\": \"EAST\",\n  \"decision\": \"DISCARD\",\n  \"label\": \"OTHER\",\n  \"flag\": \"NO\",\n  \"confidence_0_to_100\": 100,\n  \"note\": \"Applied rules: TRIANGLE → EAST, code 99 > 50 → DISCARD, marker GREEN → OTHER, completeness EMPTY → NO\"\n}"}, "done": true, "done_reason": "stop", "total_duration": 9635872800, "load_duration": 10828300, "prompt_eval_count": 114, "prompt_eval_cached_count": 113, "prompt_eval_duration": 130238000, "eval_count": 94, "eval_duration": 9482247000}, "parsed": {"route": "EAST", "decision": "DISCARD", "label": "OTHER", "flag": "NO", "confidence_0_to_100": 100, "note": "Applied rules: TRIANGLE → EAST, code 99 > 50 → DISCARD, marker GREEN → OTHER, completeness EMPTY → NO"}, "parse_error": null, "schema_errors": [], "conforming": true}
{"bench_id": "MINISTRAL_JSON_SCHEMA_BENCH_001", "manifest_sha256": "2537158596c964bf42ef465fd123d59a94cb5846cc6a8996413450ba76f191f0", "prompt_index": 3, "seed": 2104, "prompt_sha256": "3ba10686672b92c7cb4445ac4454c26b80062ce471f032a49e754f340e4c4ad7", "request": {"model": "ministral-3:3b-instruct-2512-q4_K_M", "stream": false, "think": false, "format": {"type": "object", "properties": {"route": {"type": "string", "enum": ["NORTH", "SOUTH", "EAST", "OTHER"]}, "decision": {"type": "string", "enum": ["KEEP", "CHECK", "DISCARD"]}, "label": {"type": "string", "enum": ["RED", "BLUE", "OTHER", "UNKNOWN"]}, "flag": {"type": "string", "enum": ["YES", "PARTLY", "NO"]}, "confidence_0_to_100": {"type": "integer", "minimum": 0, "maximum": 100}, "note": {"type": "string"}}, "required": ["route", "decision", "label", "flag", "confidence_0_to_100", "note"], "additionalProperties": false}, "options": {"temperature": 0.2, "top_p": 0.9, "num_predict": 220, "num_ctx": 4096, "seed": 2104}, "messages": [{"role": "system", "content": "You are completing an unrelated synthetic routing-card task. Return only the structured object required by the supplied schema."}, {"role": "user", "content": "Synthetic routing card C. Facts: shape=TRIANGLE; code=99; marker=GREEN; completeness=EMPTY. Apply these toy rules: TRIANGLE routes EAST; code above 50 means DISCARD; a marker other than RED or BLUE uses label OTHER; EMPTY means flag NO. Give a confidence from 0 to 100 and a short note."}]}, "raw_response": {"model": "ministral-3:3b-instruct-2512-q4_K_M", "created_at": "2026-09-17T23:03:42.7268166Z", "message": {"role": "assistant", "content": "{\n  \"route\": \"EAST\",\n  \"decision\": \"DISCARD\",\n  \"label\": \"OTHER\",\n  \"flag\": \"NO\",\n  \"confidence_0_to_100\": 100,\n  \"note\": \"Applied rules: TRIANGLE → EAST; code 99 > 50 → DISCARD; marker GREEN (not RED/BLUE) → OTHER; EMPTY → NO flag.\"\n}"}, "done": true, "done_reason": "stop", "total_duration": 8967579100, "load_duration": 13867900, "prompt_eval_count": 114, "prompt_eval_cached_count": 113, "prompt_eval_duration": 149360000, "eval_count": 101, "eval_duration": 8790679000}, "parsed": {"route": "EAST", "decision": "DISCARD", "label": "OTHER", "flag": "NO", "confidence_0_to_100": 100, "note": "Applied rules: TRIANGLE → EAST; code 99 > 50 → DISCARD; marker GREEN (not RED/BLUE) → OTHER; EMPTY → NO flag."}, "parse_error": null, "schema_errors": [], "conforming": true}
