{"bench_id": "MINISTRAL_JSON_SCHEMA_BENCH_001", "manifest_sha256": "2537158596c964bf42ef465fd123d59a94cb5846cc6a8996413450ba76f191f0", "prompt_index": 1, "seed": 2101, "prompt_sha256": "16447d2cdf98c567e31eccaad1efdf09d56b694472c8b08a84021e855b9cc4af", "request": {"model": "ministral-3:3b-instruct-2512-q4_K_M", "stream": false, "think": false, "format": {"type": "object", "properties": {"route": {"type": "string", "enum": ["NORTH", "SOUTH", "EAST", "OTHER"]}, "decision": {"type": "string", "enum": ["KEEP", "CHECK", "DISCARD"]}, "label": {"type": "string", "enum": ["RED", "BLUE", "OTHER", "UNKNOWN"]}, "flag": {"type": "string", "enum": ["YES", "PARTLY", "NO"]}, "confidence_0_to_100": {"type": "integer", "minimum": 0, "maximum": 100}, "note": {"type": "string"}}, "required": ["route", "decision", "label", "flag", "confidence_0_to_100", "note"], "additionalProperties": false}, "options": {"temperature": 0.2, "top_p": 0.9, "num_predict": 220, "num_ctx": 4096, "seed": 2101}, "messages": [{"role": "system", "content": "You are completing an unrelated synthetic routing-card task. Return only the structured object required by the supplied schema."}, {"role": "user", "content": "Synthetic routing card A. Facts: shape=CIRCLE; code=17; marker=BLUE; completeness=FULL. Apply these toy rules: CIRCLE routes NORTH; code above 10 means CHECK; use the observed marker as label; FULL means flag YES. Give a confidence from 0 to 100 and a short note."}]}, "raw_response": {"model": "ministral-3:3b-instruct-2512-q4_K_M", "created_at": "2026-09-17T23:01:33.5209573Z", "message": {"role": "assistant", "content": "{\n  \"route\": \"NORTH\",\n  \"decision\": \"CHECK\",\n  \"label\": \"BLUE\",\n  \"flag\": \"YES\",\n  \"confidence_0_to_100\": 100,\n  \"note\": \"Synthetic routing based on shape, code, marker, and completeness.\"\n}"}, "done": true, "done_reason": "stop", "total_duration": 17775383400, "load_duration": 8884874500, "prompt_eval_count": 105, "prompt_eval_cached_count": 0, "prompt_eval_duration": 2566173000, "eval_count": 74, "eval_duration": 6297026000}, "parsed": {"route": "NORTH", "decision": "CHECK", "label": "BLUE", "flag": "YES", "confidence_0_to_100": 100, "note": "Synthetic routing based on shape, code, marker, and completeness."}, "parse_error": null, "schema_errors": [], "conforming": true}
{"bench_id": "MINISTRAL_JSON_SCHEMA_BENCH_001", "manifest_sha256": "2537158596c964bf42ef465fd123d59a94cb5846cc6a8996413450ba76f191f0", "prompt_index": 1, "seed": 2102, "prompt_sha256": "16447d2cdf98c567e31eccaad1efdf09d56b694472c8b08a84021e855b9cc4af", "request": {"model": "ministral-3:3b-instruct-2512-q4_K_M", "stream": false, "think": false, "format": {"type": "object", "properties": {"route": {"type": "string", "enum": ["NORTH", "SOUTH", "EAST", "OTHER"]}, "decision": {"type": "string", "enum": ["KEEP", "CHECK", "DISCARD"]}, "label": {"type": "string", "enum": ["RED", "BLUE", "OTHER", "UNKNOWN"]}, "flag": {"type": "string", "enum": ["YES", "PARTLY", "NO"]}, "confidence_0_to_100": {"type": "integer", "minimum": 0, "maximum": 100}, "note": {"type": "string"}}, "required": ["route", "decision", "label", "flag", "confidence_0_to_100", "note"], "additionalProperties": false}, "options": {"temperature": 0.2, "top_p": 0.9, "num_predict": 220, "num_ctx": 4096, "seed": 2102}, "messages": [{"role": "system", "content": "You are completing an unrelated synthetic routing-card task. Return only the structured object required by the supplied schema."}, {"role": "user", "content": "Synthetic routing card A. Facts: shape=CIRCLE; code=17; marker=BLUE; completeness=FULL. Apply these toy rules: CIRCLE routes NORTH; code above 10 means CHECK; use the observed marker as label; FULL means flag YES. Give a confidence from 0 to 100 and a short note."}]}, "raw_response": {"model": "ministral-3:3b-instruct-2512-q4_K_M", "created_at": "2026-09-17T23:01:44.5248376Z", "message": {"role": "assistant", "content": "{\n  \"route\": \"NORTH\",\n  \"decision\": \"CHECK\",\n  \"label\": \"BLUE\",\n  \"flag\": \"YES\",\n  \"confidence_0_to_100\": 100,\n  \"note\": \"Applied rules for shape (CIRCLE), code (17 > 10), marker (BLUE), and completeness (FULL).\"\n}"}, "done": true, "done_reason": "stop", "total_duration": 8959277900, "load_duration": 17422900, "prompt_eval_count": 105, "prompt_eval_cached_count": 104, "prompt_eval_duration": 188520000, "eval_count": 90, "eval_duration": 8738733000}, "parsed": {"route": "NORTH", "decision": "CHECK", "label": "BLUE", "flag": "YES", "confidence_0_to_100": 100, "note": "Applied rules for shape (CIRCLE), code (17 > 10), marker (BLUE), and completeness (FULL)."}, "parse_error": null, "schema_errors": [], "conforming": true}
{"bench_id": "MINISTRAL_JSON_SCHEMA_BENCH_001", "manifest_sha256": "2537158596c964bf42ef465fd123d59a94cb5846cc6a8996413450ba76f191f0", "prompt_index": 1, "seed": 2103, "prompt_sha256": "16447d2cdf98c567e31eccaad1efdf09d56b694472c8b08a84021e855b9cc4af", "request": {"model": "ministral-3:3b-instruct-2512-q4_K_M", "stream": false, "think": false, "format": {"type": "object", "properties": {"route": {"type": "string", "enum": ["NORTH", "SOUTH", "EAST", "OTHER"]}, "decision": {"type": "string", "enum": ["KEEP", "CHECK", "DISCARD"]}, "label": {"type": "string", "enum": ["RED", "BLUE", "OTHER", "UNKNOWN"]}, "flag": {"type": "string", "enum": ["YES", "PARTLY", "NO"]}, "confidence_0_to_100": {"type": "integer", "minimum": 0, "maximum": 100}, "note": {"type": "string"}}, "required": ["route", "decision", "label", "flag", "confidence_0_to_100", "note"], "additionalProperties": false}, "options": {"temperature": 0.2, "top_p": 0.9, "num_predict": 220, "num_ctx": 4096, "seed": 2103}, "messages": [{"role": "system", "content": "You are completing an unrelated synthetic routing-card task. Return only the structured object required by the supplied schema."}, {"role": "user", "content": "Synthetic routing card A. Facts: shape=CIRCLE; code=17; marker=BLUE; completeness=FULL. Apply these toy rules: CIRCLE routes NORTH; code above 10 means CHECK; use the observed marker as label; FULL means flag YES. Give a confidence from 0 to 100 and a short note."}]}, "raw_response": {"model": "ministral-3:3b-instruct-2512-q4_K_M", "created_at": "2026-09-17T23:01:59.9228521Z", "message": {"role": "assistant", "content": "{\n  \"route\": \"NORTH\",\n  \"decision\": \"CHECK\",\n  \"label\": \"BLUE\",\n  \"flag\": \"YES\",\n  \"confidence_0_to_100\": 100,\n  \"note\": \"Synthetic routing card: CIRCLE shape → NORTH; code 17 > 10 → CHECK; marker BLUE → label; completeness FULL → flag YES\"\n}"}, "done": true, "done_reason": "stop", "total_duration": 13377155700, "load_duration": 11193200, "prompt_eval_count": 105, "prompt_eval_cached_count": 104, "prompt_eval_duration": 143363000, "eval_count": 97, "eval_duration": 13213902000}, "parsed": {"route": "NORTH", "decision": "CHECK", "label": "BLUE", "flag": "YES", "confidence_0_to_100": 100, "note": "Synthetic routing card: CIRCLE shape → NORTH; code 17 > 10 → CHECK; marker BLUE → label; completeness FULL → flag YES"}, "parse_error": null, "schema_errors": [], "conforming": true}
{"bench_id": "MINISTRAL_JSON_SCHEMA_BENCH_001", "manifest_sha256": "2537158596c964bf42ef465fd123d59a94cb5846cc6a8996413450ba76f191f0", "prompt_index": 1, "seed": 2104, "prompt_sha256": "16447d2cdf98c567e31eccaad1efdf09d56b694472c8b08a84021e855b9cc4af", "request": {"model": "ministral-3:3b-instruct-2512-q4_K_M", "stream": false, "think": false, "format": {"type": "object", "properties": {"route": {"type": "string", "enum": ["NORTH", "SOUTH", "EAST", "OTHER"]}, "decision": {"type": "string", "enum": ["KEEP", "CHECK", "DISCARD"]}, "label": {"type": "string", "enum": ["RED", "BLUE", "OTHER", "UNKNOWN"]}, "flag": {"type": "string", "enum": ["YES", "PARTLY", "NO"]}, "confidence_0_to_100": {"type": "integer", "minimum": 0, "maximum": 100}, "note": {"type": "string"}}, "required": ["route", "decision", "label", "flag", "confidence_0_to_100", "note"], "additionalProperties": false}, "options": {"temperature": 0.2, "top_p": 0.9, "num_predict": 220, "num_ctx": 4096, "seed": 2104}, "messages": [{"role": "system", "content": "You are completing an unrelated synthetic routing-card task. Return only the structured object required by the supplied schema."}, {"role": "user", "content": "Synthetic routing card A. Facts: shape=CIRCLE; code=17; marker=BLUE; completeness=FULL. Apply these toy rules: CIRCLE routes NORTH; code above 10 means CHECK; use the observed marker as label; FULL means flag YES. Give a confidence from 0 to 100 and a short note."}]}, "raw_response": {"model": "ministral-3:3b-instruct-2512-q4_K_M", "created_at": "2026-09-17T23:02:12.7074621Z", "message": {"role": "assistant", "content": "{\n  \"route\": \"NORTH\",\n  \"decision\": \"CHECK\",\n  \"label\": \"BLUE\",\n  \"flag\": \"YES\",\n  \"confidence_0_to_100\": 100,\n  \"note\": \"Applied rules: CIRCLE → NORTH, code 17 > 10 → CHECK, FULL → YES, marker as label.\"\n}"}, "done": true, "done_reason": "stop", "total_duration": 10776517100, "load_duration": 9661800, "prompt_eval_count": 105, "prompt_eval_cached_count": 104, "prompt_eval_duration": 162813000, "eval_count": 90, "eval_duration": 10595047000}, "parsed": {"route": "NORTH", "decision": "CHECK", "label": "BLUE", "flag": "YES", "confidence_0_to_100": 100, "note": "Applied rules: CIRCLE → NORTH, code 17 > 10 → CHECK, FULL → YES, marker as label."}, "parse_error": null, "schema_errors": [], "conforming": true}
{"bench_id": "MINISTRAL_JSON_SCHEMA_BENCH_001", "manifest_sha256": "2537158596c964bf42ef465fd123d59a94cb5846cc6a8996413450ba76f191f0", "prompt_index": 2, "seed": 2101, "prompt_sha256": "ded0138a19489692ff44e942e35e869223a8358336099f79a66a10603af8f91d", "request": {"model": "ministral-3:3b-instruct-2512-q4_K_M", "stream": false, "think": false, "format": {"type": "object", "properties": {"route": {"type": "string", "enum": ["NORTH", "SOUTH", "EAST", "OTHER"]}, "decision": {"type": "string", "enum": ["KEEP", "CHECK", "DISCARD"]}, "label": {"type": "string", "enum": ["RED", "BLUE", "OTHER", "UNKNOWN"]}, "flag": {"type": "string", "enum": ["YES", "PARTLY", "NO"]}, "confidence_0_to_100": {"type": "integer", "minimum": 0, "maximum": 100}, "note": {"type": "string"}}, "required": ["route", "decision", "label", "flag", "confidence_0_to_100", "note"], "additionalProperties": false}, "options": {"temperature": 0.2, "top_p": 0.9, "num_predict": 220, "num_ctx": 4096, "seed": 2101}, "messages": [{"role": "system", "content": "You are completing an unrelated synthetic routing-card task. Return only the structured object required by the supplied schema."}, {"role": "user", "content": "Synthetic routing card B. Facts: shape=SQUARE; code=4; marker=RED; completeness=PARTIAL. Apply these toy rules: SQUARE routes SOUTH; code 10 or below means KEEP; use the observed marker as label; PARTIAL means flag PARTLY. Give a confidence from 0 to 100 and a short note."}]}, "raw_response": {"model": "ministral-3:3b-instruct-2512-q4_K_M", "created_at": "2026-09-17T23:02:27.303558Z", "message": {"role": "assistant", "content": "{\n  \"route\": \"SOUTH\",\n  \"decision\": \"KEEP\",\n  \"label\": \"RED\",\n  \"flag\": \"PARTLY\",\n  \"confidence_0_to_100\": 85,\n  \"note\": \"Based on shape (SQUARE) and marker (RED). Code (4) is below 10, so KEEP. Completeness (PARTIAL) triggers 'PARTLY' flag.\"\n}"}, "done": true, "done_reason": "stop", "total_duration": 12554576400, "load_duration": 9216300, "prompt_eval_count": 108, "prompt_eval_cached_count": 29, "prompt_eval_duration": 2175074000, "eval_count": 98, "eval_duration": 10346884000}, "parsed": {"route": "SOUTH", "decision": "KEEP", "label": "RED", "flag": "PARTLY", "confidence_0_to_100": 85, "note": "Based on shape (SQUARE) and marker (RED). Code (4) is below 10, so KEEP. Completeness (PARTIAL) triggers 'PARTLY' flag."}, "parse_error": null, "schema_errors": [], "conforming": true}
{"bench_id": "MINISTRAL_JSON_SCHEMA_BENCH_001", "manifest_sha256": "2537158596c964bf42ef465fd123d59a94cb5846cc6a8996413450ba76f191f0", "prompt_index": 2, "seed": 2102, "prompt_sha256": "ded0138a19489692ff44e942e35e869223a8358336099f79a66a10603af8f91d", "request": {"model": "ministral-3:3b-instruct-2512-q4_K_M", "stream": false, "think": false, "format": {"type": "object", "properties": {"route": {"type": "string", "enum": ["NORTH", "SOUTH", "EAST", "OTHER"]}, "decision": {"type": "string", "enum": ["KEEP", "CHECK", "DISCARD"]}, "label": {"type": "string", "enum": ["RED", "BLUE", "OTHER", "UNKNOWN"]}, "flag": {"type": "string", "enum": ["YES", "PARTLY", "NO"]}, "confidence_0_to_100": {"type": "integer", "minimum": 0, "maximum": 100}, "note": {"type": "string"}}, "required": ["route", "decision", "label", "flag", "confidence_0_to_100", "note"], "additionalProperties": false}, "options": {"temperature": 0.2, "top_p": 0.9, "num_predict": 220, "num_ctx": 4096, "seed": 2102}, "messages": [{"role": "system", "content": "You are completing an unrelated synthetic routing-card task. Return only the structured object required by the supplied schema."}, {"role": "user", "content": "Synthetic routing card B. Facts: shape=SQUARE; code=4; marker=RED; completeness=PARTIAL. Apply these toy rules: SQUARE routes SOUTH; code 10 or below means KEEP; use the observed marker as label; PARTIAL means flag PARTLY. Give a confidence from 0 to 100 and a short note."}]}, "raw_response": {"model": "ministral-3:3b-instruct-2512-q4_K_M", "created_at": "2026-09-17T23:02:36.6934915Z", "message": {"role": "assistant", "content": "{\n  \"route\": \"SOUTH\",\n  \"decision\": \"KEEP\",\n  \"label\": \"RED\",\n  \"flag\": \"PARTLY\",\n  \"confidence_0_to_100\": 85,\n  \"note\": \"Based on shape (SQUARE) and marker (RED) with partial completeness; code (4) triggers KEEP.\"\n}"}, "done": true, "done_reason": "stop", "total_duration": 7360840300, "load_duration": 12448900, "prompt_eval_count": 108, "prompt_eval_cached_count": 107, "prompt_eval_duration": 140430000, "eval_count": 83, "eval_duration": 7194169000}, "parsed": {"route": "SOUTH", "decision": "KEEP", "label": "RED", "flag": "PARTLY", "confidence_0_to_100": 85, "note": "Based on shape (SQUARE) and marker (RED) with partial completeness; code (4) triggers KEEP."}, "parse_error": null, "schema_errors": [], "conforming": true}
{"bench_id": "MINISTRAL_JSON_SCHEMA_BENCH_001", "manifest_sha256": "2537158596c964bf42ef465fd123d59a94cb5846cc6a8996413450ba76f191f0", "prompt_index": 2, "seed": 2103, "prompt_sha256": "ded0138a19489692ff44e942e35e869223a8358336099f79a66a10603af8f91d", "request": {"model": "ministral-3:3b-instruct-2512-q4_K_M", "stream": false, "think": false, "format": {"type": "object", "properties": {"route": {"type": "string", "enum": ["NORTH", "SOUTH", "EAST", "OTHER"]}, "decision": {"type": "string", "enum": ["KEEP", "CHECK", "DISCARD"]}, "label": {"type": "string", "enum": ["RED", "BLUE", "OTHER", "UNKNOWN"]}, "flag": {"type": "string", "enum": ["YES", "PARTLY", "NO"]}, "confidence_0_to_100": {"type": "integer", "minimum": 0, "maximum": 100}, "note": {"type": "string"}}, "required": ["route", "decision", "label", "flag", "confidence_0_to_100", "note"], "additionalProperties": false}, "options": {"temperature": 0.2, "top_p": 0.9, "num_predict": 220, "num_ctx": 4096, "seed": 2103}, "messages": [{"role": "system", "content": "You are completing an unrelated synthetic routing-card task. Return only the structured object required by the supplied schema."}, {"role": "user", "content": "Synthetic routing card B. Facts: shape=SQUARE; code=4; marker=RED; completeness=PARTIAL. Apply these toy rules: SQUARE routes SOUTH; code 10 or below means KEEP; use the observed marker as label; PARTIAL means flag PARTLY. Give a confidence from 0 to 100 and a short note."}]}, "raw_response": {"model": "ministral-3:3b-instruct-2512-q4_K_M", "created_at": "2026-09-17T23:02:46.3793932Z", "message": {"role": "assistant", "content": "{\n  \"route\": \"SOUTH\",\n  \"decision\": \"KEEP\",\n  \"label\": \"RED\",\n  \"flag\": \"PARTLY\",\n  \"confidence_0_to_100\": 85,\n  \"note\": \"Based on shape (SQUARE) and marker (RED). Completeness (PARTIAL) triggers a flag. Code (4) is below 10, so KEEP is applied.\"\n}"}, "done": true, "done_reason": "stop", "total_duration": 7635742600, "load_duration": 12565800, "prompt_eval_count": 108, "prompt_eval_cached_count": 107, "prompt_eval_duration": 111427000, "eval_count": 97, "eval_duration": 7499309000}, "parsed": {"route": "SOUTH", "decision": "KEEP", "label": "RED", "flag": "PARTLY", "confidence_0_to_100": 85, "note": "Based on shape (SQUARE) and marker (RED). Completeness (PARTIAL) triggers a flag. Code (4) is below 10, so KEEP is applied."}, "parse_error": null, "schema_errors": [], "conforming": true}
{"bench_id": "MINISTRAL_JSON_SCHEMA_BENCH_001", "manifest_sha256": "2537158596c964bf42ef465fd123d59a94cb5846cc6a8996413450ba76f191f0", "prompt_index": 2, "seed": 2104, "prompt_sha256": "ded0138a19489692ff44e942e35e869223a8358336099f79a66a10603af8f91d", "request": {"model": "ministral-3:3b-instruct-2512-q4_K_M", "stream": false, "think": false, "format": {"type": "object", "properties": {"route": {"type": "string", "enum": ["NORTH", "SOUTH", "EAST", "OTHER"]}, "decision": {"type": "string", "enum": ["KEEP", "CHECK", "DISCARD"]}, "label": {"type": "string", "enum": ["RED", "BLUE", "OTHER", "UNKNOWN"]}, "flag": {"type": "string", "enum": ["YES", "PARTLY", "NO"]}, "confidence_0_to_100": {"type": "integer", "minimum": 0, "maximum": 100}, "note": {"type": "string"}}, "required": ["route", "decision", "label", "flag", "confidence_0_to_100", "note"], "additionalProperties": false}, "options": {"temperature": 0.2, "top_p": 0.9, "num_predict": 220, "num_ctx": 4096, "seed": 2104}, "messages": [{"role": "system", "content": "You are completing an unrelated synthetic routing-card task. Return only the structured object required by the supplied schema."}, {"role": "user", "content": "Synthetic routing card B. Facts: shape=SQUARE; code=4; marker=RED; completeness=PARTIAL. Apply these toy rules: SQUARE routes SOUTH; code 10 or below means KEEP; use the observed marker as label; PARTIAL means flag PARTLY. Give a confidence from 0 to 100 and a short note."}]}, "raw_response": {"model": "ministral-3:3b-instruct-2512-q4_K_M", "created_at": "2026-09-17T23:02:56.0320195Z", "message": {"role": "assistant", "content": "{\n  \"route\": \"SOUTH\",\n  \"decision\": \"KEEP\",\n  \"label\": \"RED\",\n  \"flag\": \"PARTLY\",\n  \"confidence_0_to_100\": 85,\n  \"note\": \"Based on shape (SQUARE) and marker (RED). Partial completeness implies incomplete data but retains primary routing logic.\"\n}"}, "done": true, "done_reason": "stop", "total_duration": 7625389300, "load_duration": 10585200, "prompt_eval_count": 108, "prompt_eval_cached_count": 107, "prompt_eval_duration": 116773000, "eval_count": 81, "eval_duration": 7489893000}, "parsed": {"route": "SOUTH", "decision": "KEEP", "label": "RED", "flag": "PARTLY", "confidence_0_to_100": 85, "note": "Based on shape (SQUARE) and marker (RED). Partial completeness implies incomplete data but retains primary routing logic."}, "parse_error": null, "schema_errors": [], "conforming": true}
{"bench_id": "MINISTRAL_JSON_SCHEMA_BENCH_001", "manifest_sha256": "2537158596c964bf42ef465fd123d59a94cb5846cc6a8996413450ba76f191f0", "prompt_index": 3, "seed": 2101, "prompt_sha256": "3ba10686672b92c7cb4445ac4454c26b80062ce471f032a49e754f340e4c4ad7", "request": {"model": "ministral-3:3b-instruct-2512-q4_K_M", "stream": false, "think": false, "format": {"type": "object", "properties": {"route": {"type": "string", "enum": ["NORTH", "SOUTH", "EAST", "OTHER"]}, "decision": {"type": "string", "enum": ["KEEP", "CHECK", "DISCARD"]}, "label": {"type": "string", "enum": ["RED", "BLUE", "OTHER", "UNKNOWN"]}, "flag": {"type": "string", "enum": ["YES", "PARTLY", "NO"]}, "confidence_0_to_100": {"type": "integer", "minimum": 0, "maximum": 100}, "note": {"type": "string"}}, "required": ["route", "decision", "label", "flag", "confidence_0_to_100", "note"], "additionalProperties": false}, "options": {"temperature": 0.2, "top_p": 0.9, "num_predict": 220, "num_ctx": 4096, "seed": 2101}, "messages": [{"role": "system", "content": "You are completing an unrelated synthetic routing-card task. Return only the structured object required by the supplied schema."}, {"role": "user", "content": "Synthetic routing card C. Facts: shape=TRIANGLE; code=99; marker=GREEN; completeness=EMPTY. Apply these toy rules: TRIANGLE routes EAST; code above 50 means DISCARD; a marker other than RED or BLUE uses label OTHER; EMPTY means flag NO. Give a confidence from 0 to 100 and a short note."}]}, "raw_response": {"model": "ministral-3:3b-instruct-2512-q4_K_M", "created_at": "2026-09-17T23:03:08.1037442Z", "message": {"role": "assistant", "content": "{\n  \"route\": \"EAST\",\n  \"decision\": \"DISCARD\",\n  \"label\": \"OTHER\",\n  \"flag\": \"NO\",\n  \"confidence_0_to_100\": 100,\n  \"note\": \"Applied rules: TRIANGLE → EAST; code 99 > 50 → DISCARD; marker GREEN ≠ RED/BLUE → OTHER; EMPTY → NO flag.\"\n}"}, "done": true, "done_reason": "stop", "total_duration": 9991441400, "load_duration": 11141900, "prompt_eval_count": 114, "prompt_eval_cached_count": 29, "prompt_eval_duration": 1586123000, "eval_count": 100, "eval_duration": 8371281999}, "parsed": {"route": "EAST", "decision": "DISCARD", "label": "OTHER", "flag": "NO", "confidence_0_to_100": 100, "note": "Applied rules: TRIANGLE → EAST; code 99 > 50 → DISCARD; marker GREEN ≠ RED/BLUE → OTHER; EMPTY → NO flag."}, "parse_error": null, "schema_errors": [], "conforming": true}
